Accession, Exception, Description
KX431437, exception-KX431437, ORF1a and ORF1b --- doubt
HV042517, exception-HV042517, bad genbank
GQ261222, exception-GQ261222, bad genbank
CS790749, exception-CS790749, bad genbank
JX993277, exception-JX993277, bad genbank
MG692436, exception-MG692436, bad genbank
MH933794, exception-MH933794, bad genbank
X86560, exception-X86560, no ORF2
MH933795, exception-MH933795, no ORF2
MH933793, exception-MH933793, no ORF2
KX274477, exception-KX274477, VP1 in ORF2
AY603425, exception-AY603425, the part of NC_006554 (see gb COMMENT)
HM002617, exception-HM002617, no ORF1 qualificator --- doubt
KY040366, exception-KY040366, ???
MF175077, exception-MF175077, ! --- no errors, strange orf1
LC215898, exception-LC215898, ! --- no errors, strange orf1